{
  "$schema": "https://github.com/Falsifyer/Defensible-CTI/schemas/pir.schema.json",
  "schema_version": "1.0",
  "id": "PIR-2026-Q4",
  "version": "1.0",
  "requirements": [
    {
      "id": "PIR-001",
      "question": "Which actors attack the supply chain of the energy sector?",
      "decision": "Which suppliers enter the quarterly monitoring plan.",
      "consumer": "Intelligence team",
      "priority": "high",
      "deadline": "2026-12-31",
      "status": "open",
      "eei": [
        {
          "id": "EEI-001",
          "question": "Are there documented campaigns against sector suppliers?",
          "indicators": [
            {"value": "campaigns published this quarter", "source": "B2"},
            {"value": "suppliers named in third-party advisories", "source": "A1"}
          ]
        },
        {
          "id": "EEI-002",
          "question": "Has access to those suppliers' source code been observed?",
          "indicators": [
            {"value": "repository access incidents", "source": "B2"}
          ]
        }
      ]
    },
    {
      "id": "PIR-002",
      "question": "Which initial-access techniques do sector brokers use?",
      "decision": "Which detection rules are prioritised this quarter.",
      "consumer": "Detection engineering",
      "priority": "medium",
      "deadline": "2027-03-31",
      "status": "open",
      "eei": [
        {
          "id": "EEI-003",
          "question": "Which techniques appear in at least two sector campaigns?",
          "indicators": [
            {"value": "techniques with two or more independent sources", "source": "A2"}
          ]
        }
      ]
    }
  ]
}
